Job Title,Salary Estimate,Job Description,Rating,Company Name,Location,Headquarters,Size,Founded,Type of ownership,Industry,Sector,Revenue,Competitors,min_salary,max_salary,avg_salary,company_txt,job_state,job_at_hq,age,python_yn,R_yn,spark,aws,excel
Data Scientist,$64K-$106K (Glassdoor est.),"Description

SAIC is seeking an individual for a Data
Analytics role to join the Space and Missions Group (SMSG). SMSG provides
specialized program management, engineering, analysis and operations support to
a variety of Intelligence Community (IC) and Department of Defense (DoD)
customers. You would support the cutting-edge programs in national
security-related systems based in space, in the air and on the ground.

This Data Analytics role will work in a collaborative
team-focused environment with technical understanding and practical
application in prototyping, designing, and
integrating niche tools which will be used in an analytical environment.
This position will help progress, establish, incorporate, and advance current
and promising concepts to inform tactical decision making timelines. Your role
is to provide needed knowledge and proficiency to develop algorithms, support
modeling and simulation efforts and provide data analytic skills to conduct
analyses to support physics-based modeling for Indications and Warning
platforms and sensor systems in the defensive space domain. This position
is available immediately and is in direct support to the community’s space
situational awareness mission.

Responsibilities include but are not limited to:

- Conduct analysis of mission data
applicable to defensive space domain to promote awareness and understanding
about threat behaviors and vulnerabilities
Formulate and interpret problems in mathematical or computational terms
Design, develop, use, and evaluate mathematical models, methods, and
algorithm application to explore concepts and solve problems for the customer
Develop, maintain, and enhance complex and diverse software algorithms (e.g.
processing-intensive analytics, novel process development, manipulation of
large data sets)
Advance and progress space-based models for integration into simulation
scenarios

- Research analysis products and
tools for possible integration to enhance Modeling & Simulation framework

- Create
new tools and applications using a variety of software languages, frameworks,
and libraries
Improve, support, and test a Modeling &
Simulation framework to support other team member’s analysis work

- Refine and enhance existing applications to better meet the
customer’s mission
Code, test, and maintain internally developed mathematical software
tools

Qualifications

A Bachelor's Degree in Mathematics, Physics, Information Technology
field, Operations Research or related discipline is required
Three years of experience of demonstrated
on-the-job knowledge of providing data analytics solutions
Demonstrated proficiency in programming languages such as Python, C/C++,
Java, .NET on windows and UNIX systems as appropriate
Hands-on experience creating algorithms and engineering tools for data
processing and modeling and simulation
Practical understanding in modeling and simulation with a focus on
optimization, including theoretical and numerical methods for analysis of
current and future systems
Must have the aptitude and attitude to tackle
unsolved technical challenges
Capability to distill complex problems into
digestible structures/formats
Active TS/SCI",3.7,"SAIC
3.7","Chantilly, VA","Reston, VA",10000+ employees,2013,Company - Public,Enterprise Software & Network Solutions,Information Technology,$5 to $10 million (USD),"Booz Allen Hamilton, CACI International",64,106,85.0,"SAIC
",VA,0,7,1,0,0,0,0
Data Scientist,$64K-$106K (Glassdoor est.),"Job Success Profile

Data Scientist

Buckman is a privately held, global specialty chemical company with headquarters in Memphis, TN, USA, committed to safeguarding the environment, maintaining safety in the workplace, and promoting sustainable development. Buckman delivers exceptional service and innovative solutions to our customers globally in the pulp and paper, leather, and water treatment sectors to help boost productivity, reduce risk, improve product quality, and provide a measurable return on investment. Buckman is in the middle of a digital transformation of its businesses and focused on building the capabilities and tools in support of this.

Position Summary


Buckman is seeking an experienced Data Scientist to lead the development of a Data Science program at our Memphis facility. You will work closely with Buckman stakeholders to derive deep industry knowledge across paper, water, leather, and performance chemical industries. You will help develop a data strategy for the company including collection of the right data, creation of the data science project portfolio, partnering with external providers, and augmenting capabilities with additional internal hires. A large part of the job is communicating and developing relationship with key stakeholders and subject matter experts to tee up proofs of concept projects to demonstrate how data science can be used to solve old problems in unique and novel ways. You will not have a large internal team to rely on, at least initially, so individual expertise, breadth of data science knowledge, and ability to partner with external companies will be essential for success. In addition to the pure data science problems, you will be working closely with a multi-disciplinary team consisting of sensor scientists, software engineers, network engineers, mechanical/electrical engineers, and chemical engineers in the development, and deployment of IoT solutions. If you like working for an entrepreneurial company with a Sustainability mission and digital ambitions at the core of its strategy, Buckman is the place for you.

Competencies Needed for Success
Bachelor’s degree in a quantitative field such as Data Science, Statistics, Applied Mathematics, Physics, Engineering, or Computer Science
5+ years of relevant working experience in an analytical role involving data extraction, analysis, and visualization and expertise in the following areas:
Expertise in one or more programming languages R, Python, MATLAB, JMP, Minitab, Java, C++, Scala
Key libraries such as Sklearn, XgBoost, GLMNet, Dplyr, ggplot, Rshiny
Experience and knowledge of data mining algorithms including supervised and unsupervised machine learning techniques areas such as Gradient Boosting, Decision Trees, Multivariate Regressions, Logistic regressions, Neural Network, Random Forest, Support Vector Machine, Naive Bayes, Time Series, Optimization
Microsoft IoT/data science toolkit: Azure Machine Learning, Datalake, Datalake analytics, Workbench, IoT Hub, Stream Analytics, CosmosDB, Time Series Insights, PowerBI
Data querying languages (e.g. SQL, Hadoop/Hive) and Preferred Qualifications
A demonstrated record of success with a verifiable portfolio of problems tackled
Preferred Qualifications
Master’s or PhD degree in a quantitative field such as Data Science, Statistics, Applied Mathematics, Physics, Engineering, or Computer Science
Experience in the specialty chemicals sector or similar industry
Background in engineering, especially Chemical Engineering
Experience starting up a data science program
Experience working with global stakeholders
Experience working in a start-up environment, preferably in an IoT company
Knowledge in quantitative modeling tools and statistical analysis
Preferred Work Style
A strong business focus, ownership and inner self-drive to data science solutions to real-world customers with tangible impact.
Ability to collaborate effectively with multi-disciplinary and passionate team members.
Ability to communicate with a diverse set of stakeholders
Strong planning and organization skills, with the ability to manage multiple complex projects
A life-long learner who constantly updates skills
Language: English

Location: Remote Work Opportunity - Flexible

Travel: <10>",3.5,"Buckman
3.5","Memphis, TN","Memphis, TN",1001 to 5000 employees,1945,Company - Private,Chemical Manufacturing,Manufacturing,$500 million to $1 billion (USD),-1,64,106,85.0,"Buckman
",TN,1,75,1,0,0,0,0
Data Scientist,$64K-$106K (Glassdoor est.),"100% REMOTE

The Role: Our customer is looking to improve the ingestion and exploitation of data by deploying innovative technologies to filter and categorize the vast amounts of data.

The Company:
We opened our doors in 2003 and have developed long-standing relationships with our customers, both public and private
We’re an SBA 8(a) and CVE certified Service Disabled Veteran Owned Small Business
We’re ISO 27001:2013, ISO 20000-1:2011, and ISO 9001:2015 certified and have CMMI DEV and SVC ML3 ratings
We’ve been named part of: Inc 5000’s Fastest Growing Private Companies in 2016; Washington Business Journal’s Fastest Growing Companies in 2015, 2016 and 2017; Washington Business Journal’s Best Places to Work in 2015, 2016 and 2017
The Employer:
We offer great benefits - Paid Time Off, Medical, Dental and Vision Insurance, 401(k) with company matching
We invest in our employees – We offer an annual training budget to our employees and opportunities for growth within the organization
We work hard, we play hard – We value work/life balance. We hold seasonal company events and a Washington Nationals Season Tickets lottery
What will you be doing?:
Building solutions to give time back to analysts to perform analytics giving them more relevant and accurate data from the various data sources they may not be aware of while maintaining referenceable data provenance.
Research and develop categorization, correlation, and learning models for data analysis and data discovery
Collaborate with customers and stakeholders to devise possible solutions for data sharing environments
Keep up-to-date with the latest technology trends, communicating results and ideas to key decision makers
Implement new statistical or other mathematical methodologies as needed for specific models or analysis
Support synergizing data solutions with IT requirements management products for new initiatives to include data modeling
Communicate and coordinate with program stakeholders
You meet our “must haves” if:

You have-
7+ years of relevant experience
Experience in theoretical and practical background in statistical analysis, machine learning, predictive modeling, and/or optimization.
Experience developing in languages commonly used for data analysis such as Python, R, Julia, or SAS
Experience working with databases such as SQL or MongoDB.
Experience working with large-scale data sets.
Experience producing data visualizations for a variety of different audiences.
Excellent verbal and written communications skills along with the ability to present technical data and approaches to both technical and non- technical audiences.
Clearance requirements:
Must have an active Secret Clearance
This position is contingent upon budget, and/or customer approval.

IT Concepts is an Affirmative Action/Equal Opportunity employer. As such, any personnel decisions (hire, promotion, job status, etc.) on applicants and/or employees are based on merit, qualifications, competence and business needs, not on race, color, citizenship status, national origin, ancestry, gender, sexual orientation, gender identity, age, religion, creed, physical or mental disability, pregnancy, childbirth or related medical condition, genetic information of the employee or family member of the employee, marital status, veteran status, political affiliation, or any other factor protected by federal, state or local law.

To perform this job successfully, an individual must be able to perform each essential duty satisfactorily. Reasonable Accommodations may be made to enable qualified individuals with disabilities to perform the essential functions.",4.8,"IT Concepts
4.8",Virginia,"Vienna, VA",51 to 200 employees,2003,Company - Private,IT Services,Information Technology,$10 to $25 million (USD),-1,64,106,85.0,"IT Concepts
",Virginia,0,17,1,0,0,0,1
Lead Data Scientist,$64K-$106K (Glassdoor est.),"Position: Lead Data Scientist

Location: Cincinnati, OH

Full-time, exempt

Join the PatientPoint Business Intelligence & Data Science team in our new Kenwood Cincinnati headquarters office space. Work for a growing entrepreneurial organization where you can apply your critical thinking skills and your ideas and suggestions are valued. Be a part of a team that implements emerging technology and applies the latest quantitative methods to solve complex problems.

What you will be doing

Far beyond just executing analysis, this key role collaborates, designs and creates statistical models and case study designs that fundamentally change the way we do business. See your greatest works appear in downstream dashboards, mission critical predictive models and processes that are based on successful machine learning.

Work on a team with data engineers that will build data ingestion & transformation processes to support your industry leading data science applications in predictive modeling and machine learning deployments. Design, create and deploy analytics solutions leveraging billions of log records from digital interactive touchscreen devices.

This position offers you a great opportunity to help build out an entire data science roadmap with the flexibility and the responsibility to develop accurate and reliable data products. This person plays an important role in selecting statistical methodologies and therefore must have a passion for staying current on the newest developments in the data science space.

As a data scientist, you will apply your critical thinking skills to understand and, sometimes, reframe high level business questions, prototype new ideas, run experiments, and iterate to better design data driven solutions to business problems. On other projects you might create advanced data queries and scripts for creating useful model features - including leveraging data from multiple external APIs.

There are opportunities to lead client-facing presentations, communication, and overall project ownership. Moreover, there are opportunities for data science thought leadership to lead the data science strategy and execution for large programs.

Plus, there will be minimal travel, we have a new office space, you will have career growth opportunities, you will get interesting projects and can enjoy free coffee!

What you need to be successful

A college degree and several years of work experience. Your experience should include direct hands-on work using analytics to establish and change business policy. MS degree preferred in applied statistics, computer science or engineering.

You must have strong statistical modeling skills. The ideal candidate will have advanced knowledge of machine learning and predictive modeling techniques. You will be asked to provide an example from your experience leading predictive modeling initiatives. You will need these and other skills to mine large amounts of data and perform data analysis to extract actionable insights for a wide range of topics including internal operations, product development, campaign performance, market dynamics, etc.

This position requires that you have mastery and experience with statistical programming in R and Python. You must be very proficient with Python including Pandas, NumPy and Scikit-learn. In R, you must be comfortable with the tidyverse (dplyr and ggplot2) but also specific libraries for training linear and non-linear models, survival analysis, time series forecasting, etc.

Mastery of SQL programming and relational data extract. Data definition, transformation and preaggregation techniques helpful.

Ability to break down complex business and technical problems into opportunities for analytical study. Particularly, you should have experience with and know when to apply regression analysis, A/B testing, power analysis, anomaly detection, model validation and selection, building of ensemble models, network analysis, simulation, conducting inferential analysis with spatial and time series data, nearest neighbor, deep learning methods, etc.

Experience with data visualization tools (ex: Microsoft PowerBI)

Excellent verbal, written, and presentation skills demonstrating an ability to ""tell a story"", listening and persuasion.

Experience with storage and retrieval of data in NoSQL databases helpful.

Visa sponsorship is not available for this position.

Kudos if you have:

Working knowledge of graph databases.

Experience with Microsoft SQL Server Integration Services (SSIS 2012 and higher).

Experience with geospatial analysis.

Experience with reporting using SalesForce Wave or Einstein Analytics

This is an excellent opportunity and includes a competitive pay and benefits package, including health, dental, vision, disability, and life insurance as well as 401(k) retirement plan with matching company contribution, paid time off, and holidays. No relocation is available.

PatientPoint® is a patient engagement solutions company passionately committed to making every doctor-patient engagement better. By harnessing the power of technology, our omnichannel platform more effectively educates and empowers patients, caregivers and staff to deliver improved health outcomes and an enhanced patient experience. For 30 years, hospitals, health systems, physician offices and sponsoring brands have trusted PatientPoint and its more than 450 team members to provide a uniquely integrated experience across care settings. Learn more at patientpoint.com.

Employer is EOE/M/F/D/V",3.9,"PatientPoint
3.9","Cincinnati, OH","Cincinnati, OH",201 to 500 employees,1987,Company - Private,Advertising & Marketing,Business Services,$100 to $500 million (USD),"Outcome Health, Health Media Network, Mesmerize Marketing",64,106,85.0,"PatientPoint
",OH,1,33,1,0,0,0,1
Data Scientist,$64K-$106K (Glassdoor est.),"Job Title: Data Scientists

Job Description
Join an elite group dedicated to continuous personal improvement as GCT is currently seeking Data Scientists of all levels to support an intelligence agency with insights gained from analyzing voluminous sensor data. The ideal candidate is adept at using large data sets to find opportunities for process optimization and using models to test the effectiveness of different courses of action. Candidates must have strong experience using a variety of data mining/data analysis methods, using a variety of data tools, building and implementing models, using/creating algorithms and creating/running simulations. The right candidate will have a passion for discovering solutions hidden in large data sets and working with stakeholders to improve business outcomes.

Clearance: TS/SCI w/Full scope polygraph (or used within the past 24 months)

Education/Experience Requirements

Senior Positions:
Masters degree in Data Science, Statistics, Mathematics, Computer Science or another quantitative field, or extensive comparable experience
10+ years of relevant experience
Junior/Intermediate Positions
Completed B.S. in Data Science, Mathematics, Statistics, Computer Science, Computer Engineering, or a closely related technical field
3-9 years of relevant experience
Qualifications
Experience using statistical computer languages (SAS, SPSS, R, Python, SLQ, etc.) to manipulate data and draw insights fromlarge data sets
Experience working with and creating data architectures
Knowledge of a variety of machine learning techniques (clustering, decision tree learning, artificial neural networks, etc.) and their real-world advantages/drawbacks
Knowledge of advanced statistical techniques and concepts (regression, properties of distributions, statistical tests and proper usage, etc.) and experience with applications
Excellent written and verbal communication skills
Strong problem solving skills
A drive to learn and master new technologies and techniques
Desired Skills
Experience manipulating data sets and building statistical models
Coding knowledge and experience with several languages: C, C++, Java, JavaScript, etc.
Knowledge and experience in statistical and data mining techniques: GLM/Regression, Random Forest, Boosting, Trees, text mining, social network analysis, Bayes, etc.
Experience querying databases and using statistical computer languages: R, Python, SLQ, etc.
Experience using web services: Redshift, S3, Spark, DigitalOcean, AWS, etc.
Experience creating and using advanced machine learning algorithms and statistics: regression, simulation, scenario analysis, modeling, clustering, decision trees, neural networks, etc.
Experience analyzing data from 3rd party providers: Google Analytics, Site Catalyst, Coremetrics, Adwords, Crimson Hexagon, Facebook Insights, etc.
Experience with distributed data/computing tools: Map/Reduce, Hadoop, Hive, Spark, Gurobi, MySQL, etc.
Experience visualizing/presenting data for stakeholders using: Periscope, Business Objects, D3, ggplot, etc.
The success of Great-Circle Technologies depends on the success and well-being of its employees. GCT promotes work/life balance and encourages the overall well-being of each of its contributors. A comprehensive benefits package is provided, which currently includes company paid single medical, dental, life, disability, and long-term care insurances (with contributions to family premiums,) matching 401k plan, 34 days off per year including 10 Federal holidays plus the day after Thanksgiving, Christmas and New Year’s eves!

Join us at Great-Circle Technologies, where innovation is the shortest distance between two points.

Great-Circle Technologies is an Equal Opportunity Employer. Great-Circle Technologies ensures all qualified applicants will receive consideration for employment without regard to gender, race, ethnic background, religion, disability, sexual orientation, gender identity, national origin, age, or protected veteran status.",2.2,"Great-Circle Technologies
2.2","Chantilly, VA","Chantilly, VA",1 to 50 employees,2000,Company - Private,Enterprise Software & Network Solutions,Information Technology,$1 to $5 million (USD),-1,64,106,85.0,"Great-Circle Technologies
",VA,1,20,1,0,1,1,1
