Job Title,Salary Estimate,Job Description,Rating,Company Name,Location,Headquarters,Size,Founded,Type of ownership,Industry,Sector,Revenue,Competitors,min_salary,max_salary,avg_salary,company_txt,job_state,job_at_hq,age,python_yn,R_yn,spark,aws,excel
Data Scientist,$64K-$106K (Glassdoor est.),"***Please note: All hiring and recruitment at Spring Health is handled with a valid '@springhealth.com' email address only or from recruitment firms @oxeonpartners.com, @neptunepeople.com, @rivierapartners.com, or @swingtalent.com. If you receive a message from a sender whose domain is not @springhealth.com, please beware that those communications are not authorized or coming from Spring Health. ***

Our mission: helping individuals and organizations thrive by eliminating every barrier to mental health.

Spring Health is a comprehensive mental health benefit for employers. We help employees understand their mental health issues and connect with best-in-class providers to get the right treatment at the right time.

We are an award-winning, passionate, and mission-driven team with the support of leaders in psychiatry, and backed by prominent VCs including Northzone, Rethink, RRE, and General Catalyst. From early detection to full recovery, Spring Health is the only clinically validated solution proven to be more effective than traditional mental healthcare. By combining the latest technology with vetted providers, we engage 1 in 3 employees, reduce recovery times, and reduce healthcare costs.

We are looking for a Data Scientist to join our R&D team. You will be responsible for designing, developing, and implementing data products throughout our organization. You will collaborate with a team of engineers, designers, product managers, social workers, psychologists, and scientists.

We are creating the future of mental healthcare: within your first year, you’ll discover something no human ever knew before about mental health.
What you’ll do at Spring Health:
Develop analytics and secure reporting approaches for a high-performing network of mental health providers
Work with product and engineering teams to improve user acquisition, patient adherence, and clinical outcomes
Develop data infrastructure to ingest and integrate multiple data sources, ETL, validate, and create automated reports for clients
Design and build data deliverables across multiple contexts, such as: claims analyses/financial ROI, longitudinal treatment outcomes, provider quality, and risk stratification algorithms
What we expect from you:
BA/BS in Psychology, Economics, Biology, Biochemistry, or other STEM-related field.
Fluency in R
Strong presentation skills — fluently tell a compelling clinical or business story with data
Strong written communication skills — quickly compose client-facing communications or publications for peer-review
Experience with Git, Python, SQL, parallel/distributed computing, cloud computing, and other data science toolkits
Experience or knowledge of traditional statistics, e.g. measures of central tendency, descriptive statistics, and inferential statistics
Possess the initiative and ability to self-direct projects and solve unconventional problems
Proximity to NYC: minimum 2 days per week in our NY HQ, max 3 days remote
What we’d love to see:
STEM PhD— especially in Applied Sciences (e.g. Biostatistics, Psychiatry, Psychology, Biological Sciences), or 3-4 years of equivalent data analysis experience
Experience using any of the following data: EMR, clinical trials, claims data, longitudinal
Demonstrated passion for, and understanding of, mental illness and broader U.S. healthcare system
Experience programming and testing statistical/machine learning models
Experience using data visualization techniques to present key findings
Ability to quickly and independently pick up concepts and skills
Experience working cross-functionally with operations, product, engineering, and design teams
Why you’ll love working at Spring Health:
Competitive compensation plan, including equity in the company: we want you to own a piece of what you’re building.
Comprehensive benefits: we offer 401k, health, dental and vision benefits as well as free mental healthcare!
World-leading science: we’re shaping the future of mental healthcare, and are at the forefront of peer-reviewed science. You’ll be the first human to discover something about how to treat mental illness.
Flexible vacation plan: our open vacation-policy allows you to take the time off you need when you need it.
Great people: make an impact on something that truly helps people alongside an incredible team.
We care about diversity: diversity allows us to build an excellent patient experience. We are an equal opportunity employer and we do not discriminate on the basis of race, religion, color, national origin, gender, sexual orientation, age, marital status, veteran status, or disability status.
We value: humility, entrepreneurship, passion for mental health, honesty and candor/directness
If you're interested in the role, please submit your CV/Resume via email to careers@springhealth.com, along with one code sample and one writing sample.

The code samples can be in any language, and the writing sample should either be 250 words, or include a 250 word abstract. Communication skills are really important to us, and we are particularly looking for a simple, direct writing style and the ability to articulate a question and research methodology clearly.",3.6,"Spring Health
3.6","New York, NY","New York, NY",1 to 50 employees,2016,Company - Private,Health Care Services & Hospitals,Health Care,Unknown / Non-Applicable,-1,64,106,85.0,"Spring Health
",NY,1,4,1,0,0,0,1
Data Scientist,$64K-$106K (Glassdoor est.),"Secure our Nation, Ignite your Future

Join the top Information Technology and Analytic professionals in the industry to make invaluable contributions to our national security on a daily basis. In this innovative, self-contained, Big Data environment, the ManTech team is responsible for everything from infrastructure, to application development, to data science, to advanced analytics and beyond. The team is diverse, the questions are thought-provoking, and the opportunities for growth and advancement are numerous

The successful candidate will possess a diverse range of data-focused skills and experience, both technical and analytical. They will have a strong desire and capability for problem solving, data analysis and troubleshooting, analytical thinking, and experimentation.

Duties, Tasks & Responsibilities
Working with large, complex, and disparate data sets
Designing and implementing innovative ways to analyze and exploit the Sponsors data holdings
Researching and reporting on a wide variety of Sponsor inquiries
Raising proactive inquiries to the Sponsor based on observations and proposed data analysis/exploitation
Solving difficult, non-routine problems by applying advanced analytical methodologies, and improving analytic methodologies
Developing custom searches
Communicating and coordinating with internal and external partners as needed
Required Experience, Skills, & Technologies
Thorough knowledge of appropriate analytic tools and methodologies in one or more of the following:
Applied mathematics (e.g. probability and statistics, formal modeling, computational social sciences)
Computer programming (e.g. programming languages, math/statistics packages, computer science, machine learning, scientific computing)
Ability to code or script in one or more general programming language
Experience with and theoretical understanding of algorithms for classification, regression, clustering, and anomaly detection
Knowledge of relational databases, including SQL and large-scale distributed systems (e.g. Hadoop)
Expertise with statistical data analysis (e.g. linear models, multivariate analysis, stochastic models, sampling methods)
Demonstrated effectiveness in collecting information and accurately representing/visualizing it to non-technical third parties
TS/SCI with Polygraph
Desired Experience, Skills & Technologies
Previous investigative experience, using a combination of technical and analytic skills
#LI-SS2

ManTech International Corporation, as well as its subsidiaries proactively fulfills its role as an equal opportunity employer. We do not discriminate against any employee or applicant for employment because of race, color, sex, religion, age, sexual orientation, gender identity and expression, national origin, marital status, physical or mental disability, status as a Disabled Veteran, Recently Separated Veteran, Active Duty Wartime or Campaign Badge Veteran, Armed Forces Services Medal, or any other characteristic protected by law.

If you require a reasonable accommodation to apply for a position with ManTech through its online applicant system, please contact ManTech's Corporate EEO Department at (703) 218-6000. ManTech is an affirmative action/equal opportunity employer - minorities, females, disabled and protected veterans are urged to apply. ManTech's utilization of any external recruitment or job placement agency is predicated upon its full compliance with our equal opportunity/affirmative action policies. ManTech does not accept resumes from unsolicited recruiting firms. We pay no fees for unsolicited services.

If you are a qualified individual with a disability or a disabled veteran, you have the right to request an accommodation if you are unable or limited in your ability to use or access http://www.mantech.com/careers/Pages/careers.aspx as a result of your disability. To request an accommodation please click careers@mantech.com and provide your name and contact information.",4.2,"ManTech
4.2","Chantilly, VA","Herndon, VA",5001 to 10000 employees,1968,Company - Public,Research & Development,Business Services,$1 to $2 billion (USD),-1,64,106,85.0,"ManTech
",VA,0,52,0,0,0,0,0
Data Scientist,$64K-$106K (Glassdoor est.),"Why We Work at Dun & Bradstreet


We are at a transformational moment in our company journey - and we’re so excited about it. Each day, we are finding new ways to strengthen our award-winning culture, and to accelerate creativity, innovation and growth. Our purpose is to help customers improve business performance with Dun & Bradstreet’s Data Cloud and Live Business Identity, and we’re wildly passionate and committed to this purpose. So, if you’re looking to make an immediate impact at a company that welcomes bold and diverse thinking, come join us!



As a Data Scientist, you will develop novel solutions to market-driven problems using knowledge of the latest ML techniques, rigorous statistical analysis, and practical experience on previous data science projects. You will collaborate with internal and external stakeholders (external customers, other D&B data scientists, sales team members, business unit product leaders, development teams, and global partners) to understand business needs and technical requirements.

You will also:
Serve as a Subject Matter Expert on internal D&B data, and estimation of business size.
Participate and support other teams as needed for all aspects of model development, including design, model implementation, validation, calibration, documentation, product implementation, monitoring, and reporting
Research complex business issues and recommend solutions, including customer data input requirements, other required data sets, modeling approaches, and end products
Basic Qualifications:
Masters in a quantitative / applied field (Engineering, Computer Science, Operations Research, Mathematics, Data Science, Economics, Statistics).
2+ years of experience in data science roles.
Strong knowledge of programming and modeling using Python, R, or SAS.
Strong SQL skills and experience working with large data sets.
Experience working collaboratively, including building and maintaining relationships with internal and external stakeholders/clients.
Experience advising a team on innovative methodologies, data science tools, and environments.
Experience communicating complex ideas to both a technical and non-technical audience.
Experience applying modern machine learning techniques.
Preferred Qualities
Creative and inquisitive in nature, flexibility to learn and apply new methodologies.
Strong writing skills.
Dun & Bradstreet is an Equal Opportunity Employer and all qualified applicants will receive consideration for employment without regard to race, color, religion, creed, sex, age, national origin, citizenship status, disability status, sexual orientation, gender identity or expression, pregnancy, genetic information, protected military and veteran status, ancestry, marital status, medical condition (cancer and genetic characteristics) or any other characteristic protected by law.

We are committed to Equal Employment Opportunity and providing reasonable accommodations to applicants with physical and/or mental disabilities. If you are interested in applying for employment with Dun & Bradstreet and need special assistance or an accommodation to use our website or to apply for a position, please send an e-mail with your request to TalentAcquisitionTeam@dnb.com. Determination on requests for reasonable accommodation are made on a case-by-case basis.

Please note that all Dun & Bradstreet job postings can be found at https://dnb.wd1.myworkdayjobs.com/Careers and all communication from Dun & Bradstreet will come from an email address ending in @dnb.com.",3.1,"Dun & Bradstreet
3.1","Austin, TX","Short Hills, NJ",1001 to 5000 employees,1841,Company - Private,IT Services,Information Technology,$1 to $2 billion (USD),"Experian, Equifax",64,106,85.0,"Dun & Bradstreet
",TX,0,179,1,0,0,0,0
(Sr.) Data Scientist -,$64K-$106K (Glassdoor est.),"Thursday, June 11, 2020

Merrick Bank is a top-25 credit card issuer and merchant acquirer in the VISA/MasterCard networks, and a major recreational vehicle lender.
The Bank is a Utah Financial Institution and a member of the FDIC.

At Merrick Bank, we specialize in credit programs that assist people looking to build or rebuild their credit. We are FDIC insured and recognized as a top-20 issuer of Visa® cards. In total, we proudly serve over 2.4 million cardholders and have extended over $5.3 billion in credit.

Our Mission is to make a positive difference in the lives of our customers, our employees, and our community. We work hard to create a work environment that empowers our associates to grow, learn, and reach their potential.

This position is a member (or, a senior member, depending upon qualifications) of the Data Science and Modeling team, and will support and work with other members of the team to produce the models, reports, and analysis as required for the bank. Data science, machine learning and statistical programming are the core competencies of the position, but in addition, the applicant should work well with others, have a desire to learn, be self-motivated, and have excellent communication and presentation skills.

REQUIRED SKILLS, ABILITIES, KNOWLEDGE, AND EXPERIENCE:
Master's degree in a relevant quantitative field, or a bachelor’s degree with a significant amount of relevant work experience.
Firm knowledge of statistical theory, data science, or machine learning algorithms is a requirement.
Expertise with R or Python is required.
Experience with any of the following computer languages is also desirable: CUDA, FORTRAN or C/C++, SAS, SQL, Unix shell scripting, or LaTeX.
Experience with HPC (High Performance Computing), or Parallel Computing would be a plus. Experience with SLURM would be outstanding.
Experience in the banking industry, specifically in credit cards, is not necessary, but would be desirable.


PRIMARY DUTIES:
Statistical programming, model development and implementation.
Communicating results, both verbally and in writing.
Work both individually and in a collaborative manner with a team.
Designing, validating, and improving data driven decision making processes and strategies.
Building key metrics and modeling reports for communication with executives.
Compliant with Laws & Regulations.

What’s in it for you:

Competitive salary (DOE)

Benefits package -Medical, Dental and Vision (plus much more)

401(k) Plan with Company Match

Short & Long Term Disability

Group Life and AD&D Insurance

Paid Vacation, Holidays, and Personal Days

Employee Events, including Employee Appreciation Day, Holiday Party, etc.

Tuition Reimbursement Program
Candidates must have unrestricted authority to work in the
United States without sponsorship.

Merrick Bank is an equal opportunity employer. We evaluate qualified applicants
without regard to race, color, religion, sex, national origin, disability,
veteran status, and other legally protected characteristic. The EEO is the
Law poster is available here: http://www1.eeoc.gov/employers/poster.cfm

Please go to our website www.merrickbank.com to apply and learn more about our company

We are an equal opportunity employer. Merrick Bank will do a thorough background check for all hires. This includes a review of your personal credit history, drug testing, background check, and employment/personal references. A good credit history is important.

Other details
Job Family
Account Acquisition & Data Science
Pay Type
Salary",3.6,"Merrick Bank
3.6",Utah,"South Jordan, UT",201 to 500 employees,1997,Company - Private,Banks & Credit Unions,Finance,Unknown / Non-Applicable,-1,64,106,85.0,"Merrick Bank
",Utah,0,23,1,0,0,1,1
Data Scientist,$64K-$106K (Glassdoor est.),"JOB DESCRIPTION:

Do you have a passion for Data and Machine Learning? Do you dream of working with customers on their most forward-looking AI initiatives? Does the challenge of developing modern machine learning solutions to solve real-world manufacturing problems exciting to you?

We develop software for monitoring semiconductor manufacturing process and are looking to leverage the latest technologies to address our customer's needs. You will be part of a team that investigates and builds solutions based all the data available in factories, ranging from time series data, to post manufacturing data, to production logs. You will be working side by side with application developers and customers on real world problems with actual manufacturing data.

JOB FUNCTION:

Basic and applied research in statistical machine learning, deep learning, and data science as well as signal and information processing to advance the state of the art in time series analysis of semiconductor manufacturing data.

Responsibilities:
Perform data analysis, data pre-processing, and feature engineering in support of advanced machine learning algorithm development. Incorporate physical and operational insights/constraints into statistical models to achieve a high degree of robustness.
Prototype algorithms for proof of concept, validation, and software implementation.
Support performance evaluations and the transition of algorithms into existing fault detection and classification systems.
Convey the results of scientific research to sponsors and the scientific community through briefings, conferences and peer-reviewed publications.
Other related functions as assigned.

REQUIRED QUALIFICATIONS:
Bachelor's degree in computer science or chemical engineering or related technical field.
Demonstrated ability in machine learning/artificial intelligence (ML/AI) development and/or scientific modelling and data analysis.
Demonstrated ability with python/MATLAB or similar abstract language. Experience with both traditional ML and modern deep learning approaches.
Experience with agile development practices and Git version control.
Experience with one or more of the DNN frameworks like TensorFlow, PyTorch, Chainer.
Experience with SQL, Graph stores, or NoSQL stores.
Applicant must have a dynamic skill set, be willing to work with new technologies, be highly organized and capable of planning and coordinating multiple tasks. The position will require attention to detail, effective problem solving skills and excellent judgment. Ability to work independently with sensitive and confidential information, maintain a professional demeanor, work as a team member without daily supervision.

COMPENSATION & BENEFITS:

Compensation will be commensurate with experience including a competitive base salary, bonus opportunity, competitive benefits package, and relocation assistance.

INFICON, is committed to ensuring that our online application process provides an equal opportunity to all job seekers that apply without regard to race, religion, ethnicity, national origin, citizenship, gender, age, protected veteran status, disability status, genetic information, sexual orientation, or any other protected characteristic. A notice describing Federal equal employment opportunity laws is available here and here to reaffirm this commitment.

PI120660357",3.5,"INFICON
3.5","Newton, MA","Bad Ragaz, Switzerland",501 to 1000 employees,2000,Company - Public,Electrical & Electronic Manufacturing,Manufacturing,$100 to $500 million (USD),"MKS Instruments, Pfeiffer Vacuum, Agilent Technologies",64,106,85.0,"INFICON
",MA,0,20,1,0,0,1,1
Data Scientist,$64K-$106K (Glassdoor est.),"Job Description


Avlino Inc. is seeking experienced data scientists to join our growing team
of AI engineers, analysts, and quantitative developers. The role involves
model construction, information extraction, prediction and finding solutions
to large-scale problems for mission critical applications using large
derived from a broad spectrum of domains for industry specific sectors. The
ideal candidate will have comprehensive expertise in machine learning,
time-series analysis modeling, statistical data analysis, and deep neural
networks. Experience with dynamic programming and reinforcement learning is
a plus.

Demonstrate your experience in creating real-world artificial intelligence
applications using pulsing customer data sets!

This is a great opportunity for an experienced Data Scientist with 4+ years
of relevant experience to work in a fast-paced environment where they can
share their passion for numbers and AI.

Responsibilities
Develop, implement, and use a broad set of machine-learning models and
quantitative techniques for prediction and classification for mission
critical applications.
To find problems in industrial and service sector applications.
Strong background in numerical techniques, optimization, and gradient
methods.
Development of new machine learning algorithms and/or substantial
modification of pre-existing techniques.
Analysis of high-volume, noisy, heterogeneous real-time data.
Collaborate with business analysts to transform customer needs into
actionable insights.
Design custom end user reports that are easy to read and interpret for
multiple business unit audiences.
Architect the next generation analytical platform.
Capable of de novo implementation of mathematical models, or to avail
widely used open source programming platforms and libraries (Scala, R,
python, TensorFlow).

Requirements
MUST: Solid 5 years of experience in machine learning, statistical
modeling, data mining, time-series forecasting, and neural networks.
MUST: Solid 5 years of experience working with big data technologies
distributed computing such as Hadoop/Spark, Map/Reduce, TensorFlow.
MUST: Solid 5 years of experience in multiple programming languages –
C#/.NET, C++, C, Scala, Python, R, Java.
Experience in developing or implementing enterprise class Data Analytics
and BI solutions.
Extremely analytical and able to solve problems independently.
Assesses customer requirements and translate them to appropriate
deliverables.
MUST: Have an analytical mind, and on point with detailed specifics.
MUST: Education: MS/Ph.D. (Preferred) in Computer Science, Physics, or a
related discipline.
PLUS: Experience in the logistics or transportation industry.",4.9,"Avlino
4.9",New Jersey,"Holmdel, NJ",1 to 50 employees,2013,Company - Private,Enterprise Software & Network Solutions,Information Technology,Less than $1 million (USD),-1,64,106,85.0,"Avlino
",New Jersey,0,7,1,0,1,0,0
