Job Title,Salary Estimate,Job Description,Rating,Company Name,Location,Headquarters,Size,Founded,Type of ownership,Industry,Sector,Revenue,Competitors,min_salary,max_salary,avg_salary,company_txt,job_state,job_at_hq,age,python_yn,R_yn,spark,aws,excel
Data Scientist/ML Engineer,$117K-$140K (Glassdoor est.),"Data Scientist/ML Engineer

Apply Now

Become part of the team

Do you crave a collaborative organization where your contributions will make a strong impact?

Do you want to develop products in the latest cloud-based technologies building ecosystems rather than creating client-facing slides?

Are you ready to roll up your sleeves and embrace a work culture that’s insanely passionate and committed to bringing the latest advanced analytics to life?

The Data Science & AI group at PA Consulting is your dream community. As part of the fastest growing innovation practice within PA Consulting, you will work with the latest advanced analytics, machine learning, and big data technologies to generate actionable insights from data and develop innovative data products. We focus on Life Science, Healthcare, Energy & Utilities and CPG sectors and work with various data sets, from social media to public health data. Our domain focus is broad and covers everything from computer vision and NLP, recommender engines, classification and clustering algorithms, linear programming and optimization.

What we're looking for

• 2-5 years professional experience as a data scientist, software engineer or statistical modeler
• Master’s degree from top tier university in Computer Science, Statistics, Economics, Physics, Engineering, Mathematics, etc.
• Expertise in machine learning algorithms and methods
• Strong understanding and application of statistical methods
• Experience writing production level code in one of the following: Python, Java, C++, C
Preferred:
• Experience working with database systems (e.g. SQL, NoSQL, MongoDB, Postgres, ect.)
• Experience working with big data distributed programming languages, and ecosystems (e.g. S3, EC2, Hadoop/MapReduce, Pig, Hive, Spark, etc)
• Experience building scalable data pipelines and with data engineering/ feature engineering.
• Webscraping leveraging Beautifulsoup, Selenium, Scrapy, etc
• Experience with front end (UI), HTML5, JavaScript, CSS, R Shiny, Tableau
• Experience leveraging ML techniques to build recommender systems, NLP engines, computer vision algorithms, etc..

Benefits


We offer a compelling benefits package that is competitive with the market and designed to reward you for achieving success.

About us


We believe in the power of ingenuity to build a positive human future in a technology-driven world.

As strategies, technologies and innovation collide, we create opportunity from complexity.

Our diverse teams of experts combine innovative thinking and breakthrough use of technologies to progress further, faster. Our clients adapt and transform, and together we achieve enduring results.

An innovation and transformation consultancy, we are over 3,200 specialists in consumer, defence and security, energy and utilities, financial services, government, health and life sciences, manufacturing, and transport. Our people are strategists, innovators, designers, consultants, digital experts, scientists, engineers and technologists. We operate globally from offices across the UK, US, Europe, and the Nordics.

PA. Bringing Ingenuity to Life.

Diversity Statement


We believe that diversity makes us a stronger firm and look to employ people with different ideas, styles and skill sets. This diversity stimulates a rich, creative environment – one in which our people develop, and our clients enjoy enduring results. We’re committed to recruiting, promoting and rewarding our people solely based on their ability to contribute to PA’s goals, without regard to their sex, race, disability, religion, national origin, ethnicity, sexual orientation, age or marital status.

We are an Equal Opportunity Employer and do not discriminate against any employee or applicant for employment because of race, color, sex, age, national origin, religion, sexual orientation, gender identity, status as a veteran, and basis of disability or any other federal, state or local protected class. VEVRAA Federal Contractor.

Country


United States


Location


New York


Contract Type


Permanent


Working Pattern


Full Time

Become part of the team

Do you crave a collaborative organization where your contributions will make a strong impact?

Do you want to develop products in the latest cloud-based technologies building ecosystems rather than creating client-facing slides?

Are you ready to roll up your sleeves and embrace a work culture that’s insanely passionate and committed to bringing the latest advanced analytics to life?

The Data Science & AI group at PA Consulting is your dream community. As part of the fastest growing innovation practice within PA Consulting, you will work with the latest advanced analytics, machine learning, and big data technologies to generate actionable insights from data and develop innovative data products. We focus on Life Science, Healthcare, Energy & Utilities and CPG sectors and work with various data sets, from social media to public health data. Our domain focus is broad and covers everything from computer vision and NLP, recommender engines, classification and clustering algorithms, linear programming and optimization.

What we're looking for

• 2-5 years professional experience as a data scientist, software engineer or statistical modeler
• Master’s degree from top tier university in Computer Science, Statistics, Economics, Physics, Engineering, Mathematics, etc.
• Expertise in machine learning algorithms and methods
• Strong understanding and application of statistical methods
• Experience writing production level code in one of the following: Python, Java, C++, C
Preferred:
• Experience working with database systems (e.g. SQL, NoSQL, MongoDB, Postgres, ect.)
• Experience working with big data distributed programming languages, and ecosystems (e.g. S3, EC2, Hadoop/MapReduce, Pig, Hive, Spark, etc)
• Experience building scalable data pipelines and with data engineering/ feature engineering.
• Webscraping leveraging Beautifulsoup, Selenium, Scrapy, etc
• Experience with front end (UI), HTML5, JavaScript, CSS, R Shiny, Tableau
• Experience leveraging ML techniques to build recommender systems, NLP engines, computer vision algorithms, etc..

Benefits


We offer a compelling benefits package that is competitive with the market and designed to reward you for achieving success.

About us


We believe in the power of ingenuity to build a positive human future in a technology-driven world.

As strategies, technologies and innovation collide, we create opportunity from complexity.

Our diverse teams of experts combine innovative thinking and breakthrough use of technologies to progress further, faster. Our clients adapt and transform, and together we achieve enduring results.

An innovation and transformation consultancy, we are over 3,200 specialists in consumer, defence and security, energy and utilities, financial services, government, health and life sciences, manufacturing, and transport. Our people are strategists, innovators, designers, consultants, digital experts, scientists, engineers and technologists. We operate globally from offices across the UK, US, Europe, and the Nordics.

PA. Bringing Ingenuity to Life.

Diversity Statement


We believe that diversity makes us a stronger firm and look to employ people with different ideas, styles and skill sets. This diversity stimulates a rich, creative environment – one in which our people develop, and our clients enjoy enduring results. We’re committed to recruiting, promoting and rewarding our people solely based on their ability to contribute to PA’s goals, without regard to their sex, race, disability, religion, national origin, ethnicity, sexual orientation, age or marital status.

We are an Equal Opportunity Employer and do not discriminate against any employee or applicant for employment because of race, color, sex, age, national origin, religion, sexual orientation, gender identity, status as a veteran, and basis of disability or any other federal, state or local protected class. VEVRAA Federal Contractor.

Back to list

Send job to a friend

Print this page

Apply Now",3.3,"PA Consulting
3.3","New York, NY","London, United Kingdom",1001 to 5000 employees,1943,Company - Private,Consulting,Business Services,$100 to $500 million (USD),"McKinsey & Company, Accenture, Deloitte",117,140,128.5,"PA Consulting
",NY,0,77,1,0,1,0,0
Data Scientist - Machine Learning,$117K-$140K (Glassdoor est.),"Headquartered in Brisbane, Calif., CareDx, Inc. is a leading precision medicine solutions company focused on the discovery, development and commercialization of clinically differentiated, high-value healthcare solutions for transplant patients and caregivers. CareDx offers products, testing services and digital healthcare solutions along the pre- and post-transplant patient journey, and is the leading provider of genomics-based information for transplant patients.

Data Scientist-Machine Learning

As a member of Data Sciences & Bioinformatics group you will be responsible for development of new machine/deep learning algorithms. The richness of a transplant data-lake a repository of large and complex data will provide the opportunity for implementation of these models. Individuals should have excellent working skills in multiple programming languages (R, Python) with demonstrated application development using TensorFlow/PyTorch. Additionally, a significant understanding of probabilistic and dynamic modelling in solving computational biology problems is highly desirable. Your contributions will be foundational to the companys mission of improving the lives of organ transplant patients.

Responsibilities:

Design, implement and support analytical data pipelines driven by TensorFlow/PyTorch
Implement predictive, generalized linear model, Bayesian Machine Learning, neural network as needed
Have excellent collaboration skills and be able to work with Software engineers for development of Data Lake
Qualifications:

Ph.D in Physics, Computational Biology, Computer Science, Math or Experimental biology with demonstrated Applied Math
5+ years experience developing and deploying scalable ML models computational biology applications are particularly desirable
Experience using TensorFlow,PyTorch, Keras, NumPy, Scipy, MLib and knowledge of ML libraries and platforms
Professional level understanding of Docker, GitHub
Ability to program against REST APIs is preferred
Expertise and experience with Data Lakes data and knowledge of ETL in this regard is highly desirable
Experience with HDFS, Apache Spark, Apache Kafka, OpenCV, Amazon EC2 is highly desirable
A self-driven approach with an ability and desire to communicate to a non-technical audience how complex systems work and can be applied to challenging data processing problems
A solid scientific foundation and familiarity with current literature
Additional Details:


Every individual at CareDx has a direct impact on our collective mission to improve the lives of organ transplant patients worldwide. We believe in taking great care of our people, so they take even greater care of our patients.

Our competitive Total Rewards package includes:
Competitive base salary and incentive compensation
Health and welfare benefits including a gym reimbursement program
401(k) savings plan match
Employee Stock Purchase Plan
Pre-tax commuter benefits
And more!
In addition, we have a Living Donor Employee Recovery Policy that allows up to 30 days of paid leave annually to a full-time employee who makes the selfless act of donating an organ or bone marrow.

With products that are making a difference in the lives of transplant patients today and a promising pipeline for the future, its an exciting time to be part of the CareDx team. Join us in partnering with transplant patients to transform our future together.

CareDx, Inc. is an Equal Opportunity Employer and participate in E-Verify program.
******* We do not accept resumes from headhunters, placement agencies, or other suppliers that have not signed a formal agreement with us.",2.6,"CareDx
2.6","Brisbane, CA","Brisbane, CA",1 to 50 employees,-1,Company - Private,Biotech & Pharmaceuticals,Biotech & Pharmaceuticals,Unknown / Non-Applicable,Sequenom,117,140,128.5,"CareDx
",CA,1,-1,1,0,1,0,1
Sr. Research Informatics Data Scientist,$117K-$140K (Glassdoor est.),"Who We Are:


At Neurocrine Biosciences, we pride ourselves on having a strong, distinctive and positive culture based on our shared purpose and values. We know what it takes to be great, and we are as passionate about our people as we are about our purpose - to relieve patient suffering and enhance lives.

What We Do:


Neurocrine Biosciences (Nasdaq: NBIX) is a neuroscience-focused, biopharmaceutical company with more than 25 years of experience discovering and developing life-changing treatments for people with serious, challenging and under-addressed neurological, endocrine and psychiatric disorders. Headquartered in San Diego, Neurocrine Biosciences specializes in targeting and interrupting disease-causing mechanisms involving the interconnected pathways of the nervous and endocrine systems.

The company’s diverse portfolio includes two FDA-approved treatments INGREZZA® (valbenazine) for tardive dyskinesia and ORILISSA® (elagolix) for endometriosis*, as well as clinical development programs in multiple therapeutic areas, including Parkinson’s disease, chorea in Huntington disease, congenital adrenal hyperplasia, uterine fibroids* and polycystic ovary syndrome.* As part of a strategic collaboration with Voyager Therapeutics, Neurocrine Biosciences is also focused on the development of investigational gene therapy programs for the treatment of severe neurological diseases, including Parkinson’s disease and Friedreich’s ataxia. (*in collaboration with AbbVie)

About the Role:
Among other responsibilities, this position is responsible for designing, modeling and developing data analysis and visualization systems that integrate laboratory, operation and research data. The Sr. Scientist leads the development and creation of workflows for data analysis using modern tools for experimental data throughout the research process with a focus on optimizing user experience, and provides data handling and data management related recommendations as well. S/he leads projects and works in collaboration with a multi-disciplinary team, develops scripts to analyze data from multiple data sources and recommends enhancements to data workflow processes, designs, builds, implements, improves and maintains high performance and highly scalable automated data pipelines. In addition, the individual oversees transition of data pipelines to production settings, develops technology choices and practices that support pipeline maturation, and researches and assesses the viability of new data management and processing technologies.

_

Your Contributions (include, but are not limited to):
Leads multiple projects and initiatives to develop and support scripts to analyze data from multiple sources in research.
Takes the lead to develop and support custom web applications (R-Shiny) for in-vitro and in-vivo experiments.
Develops and supports data queries, reports and visualizations from our Research LIMS.
Provide ad-hoc data analysis support as needed
Troubleshoot server-side application issues
Analyzes issues and recommends enhancements to data workflow processes.
Trains and mentors less experienced team members.
Generates documentation on data related processes
Other duties as assigned.
Requirements:

BS/BA degree in Statistics, Bioinformatics, Computer Science or related field and 6+ years of experience with HTML/Javascript and user interface design as well as querying and wrangling data from an Oracle Database, OR
Master’s degree in Statistics, Bioinformatics, Computer Science or related field and 4+ years of experience as noted above, OR
PharmD or PhD in Statistics, Bioinformatics, Computer Science or related field and 2+ years of experience as noted above
Expert in one or more of R/MATLAB/Python programming languages
Expert in data visualization design
Proficient in MS Office applications
Comfortable with Ubuntu and Windows Servers
Strong project management skills, with the ability to lead research informatics projects
Understands key business drivers and uses this understanding to accomplish work
Has strong understanding of processes, procedures and systems used to accomplish the work and recognizes downstream impact on other functional areas
Proficient with tools and processes that support work conducted by functional area
Ability to work as part of a team; may train lower levels
Excellent computer skills
Strong communications, problem-solving, analytical thinking skills
Detail oriented yet can see broader picture for department
Ability to meet multiple deadlines, with a high degree of accuracy and efficiency
Neurocrine Biosciences is an EEO/AA/Disability/Vets employer.",4.5,"Neurocrine Biosciences
4.5","San Diego, CA","San Diego, CA",501 to 1000 employees,1992,Company - Public,Biotech & Pharmaceuticals,Biotech & Pharmaceuticals,$500 million to $1 billion (USD),-1,117,140,128.5,"Neurocrine Biosciences
",CA,1,28,1,0,0,0,1
Senior Data Scientist,$117K-$140K (Glassdoor est.),"Group O is seeking a strong candidate with the ability to design machine learning projects to address specific business problems determined by consultation with business partners to fill an exciting Data Scientist position, in the Chicago IL or Atlanta GA area for a Group O partner.

Responsible for the development and implementation of machine learning algorithms and techniques to solve business problems and optimize member experiences. Primary duties may include are but not limited to: Design machine learning projects to address specific business problems determined by consultation with business partners. Work with data-sets of varying degrees of size and complexity including both structured and unstructured data. Piping and processing massive data-streams in distributed computing environments such as Hadoop to facilitate analysis. Implements batch and real-time model scoring to drive actions. Develops machine learning algorithms to build customized solutions that go beyond standard industry tools and lead to innovative solutions. Develop sophisticated visualization of analysis output for business users.

BS/MA/MS/PhD in Statistics, Computer Science, Mathematics, Machine Learning, Econometrics, Physics, Biostatistics or related Quantitative disciplines. 5 years experience in predictive analytics and advanced expertise with software such as Python, or any combination of education and experience which would provide an equivalent background. Experience leading end-to-end data science project implementation. Experience in the health-care sector. Experience in Deep Learning strongly preferred.",3.1,"Group O
3.1","Chicago, IL","Milan, IL",1001 to 5000 employees,1974,Company - Private,Staffing & Outsourcing,Business Services,$500 million to $1 billion (USD),-1,117,140,128.5,"Group O
",IL,0,46,1,0,0,0,0
Senior Data Scientist,$117K-$140K (Glassdoor est.),"Location: San Francisco, CA- United States
Job ID: 20WD40666

Position Overview
Autodesk is seeking a Senior Data Scientist to join our Data Platform & Insights organization. The organization is chartered with building innovative data products and analytics solutions for Autodesk’s strategy, product, marketing, sales and customer support teams. This critical data scientist role will help us make machine intelligence an integral part of how Autodesk makes decisions and designs and builds its products.

You will work alongside a product development team and apply data mining, analytics and machine learning methods to understanding how customers use, adopt and achieve successful outcomes with our products. The ideal candidate is a strong data scientist who thinks outside the box, is naturally curious, highly collaborative, and has a passion for tackling complex data-centric problems.

Responsibilities
Work on a variety of problems that seek to better understand how customers use their products and what drives deeper adoption and usage of products
Apply your quantitative analysis, data mining and machine learning expertise to building models that make sense of user needs, usage patterns, factors that drive deeper adoption and contribute to subscriber churn
Influence product development, strategy and roadmap prioritization
Design and implement machine learning pipelines that improve Autodesk’s evidence-based decision-making capabilities
Tackle complex problems requiring a creative mindset to find innovative and elegant solutions

Minimum Qualifications
BS/MS/PhD in the fields of: Mathematics, Physical Sciences, Statistics/Analytics, Computer Science, or other relevant fields
Experience working with relational SQL and/or NoSQL databases
Experience working with big data platforms (Hadoop, Spark, Hive)
Fluency with one or more programming language: Python, Java, Scala, etc.
Good understanding of CS fundamentals, e.g. algorithms and data structures
Experience in statistical programming tools such as R, Matlab, SAS, Python data science toolkits, etc.
Experience with data science toolkits like pandas, Jupyter, scikit, TensorFlow, etc.
Familiarity with Statistics concepts and analysis, e.g. hypothesis testing, regression, experimental design, etc.
Familiarity with Machine Learning techniques, e.g. classification, clustering, regularization, optimization, dimension reduction, etc.
Good communication skills and ability to explain complex topics to both technical and non-technical audience as well",4.0,"Autodesk
4.0","San Francisco, CA","San Rafael, CA",5001 to 10000 employees,1982,Company - Public,Computer Hardware & Software,Information Technology,$2 to $5 billion (USD),-1,117,140,128.5,"Autodesk
",CA,0,38,1,0,1,0,0
Data Scientist,$117K-$140K (Glassdoor est.),"At Wish, our Data Science & Engineering team is comprised of Data Scientists, Data Analysts & Data Engineers who focus on centralizing corporate data in order to gain insights, knowledge and scalability, that empower a proactive and rigorous analysis of key business indicators. Our mission is to derive wisdom from data via the application of Data Science.

Wish has exciting opportunities for talented Data Scientists to form the foundation of our centralized data science team. Successful candidates will have extensive backgrounds in a quantitative fields and s track record of using data to drive the understanding, growth, and the success of a product. As a member of this team, you will be empowered and motivated to drive business impact through data.

As a Data Scientist at Wish, you will:
Apply statistics techniques to improve Wish’s experimentation platform and process.
Apply economics methodologies to understand and improve Wish’s two-sided marketplace.
Apply optimization techniques to improve Wish’s logistics and overall user experiences.
Apply machine learning techniques to improve Wish’s product and operation.
Required Skills & Experience:
Advanced degree in a quantitative field.
A minimum of 3 years of Data Science experience in technology or research industry.
Proficient in Python or R
Preferred skills:
Demonstrated track record of successful projects in applying quantitative techniques to improve a product or business.
5+ years work experience in technology or research industry.
Domain expert in one of the fields: statistics, machine learning, optimization, and economics.
Why Wish:

Wish is transforming the way the world shops by offering a convenient and personalized mobile shopping experience. Our mission is to offer an unlimited selection of affordable quality goods to be accessible for everyone on a global scale. We bring together world-class technical talent with a passion for connecting relevant products to relevant people.

Learn more about us:
Intro to Wish
Our CEO discusses Wish
Crunchbase
Recruiting Video

Wish values diversity and is committed to creating an inclusive work environment. We provide equal employment opportunity for all applicants and employees. We do not discriminate based on any legally-protected class or characteristic. Employment decisions are made based on qualifications, merit, and business needs. If you need assistance or accommodation due to a disability, please let your recruiter know. For job positions in San Francisco, CA, and other locations where required, we will consider for employment qualified applicants with arrest and conviction records.


Individuals applying for positions at Wish, including California residents, can see our privacy policy here.",3.5,"Wish
3.5","San Francisco, CA","San Francisco, CA",501 to 1000 employees,2011,Company - Private,Other Retail Stores,Retail,$1 to $2 billion (USD),-1,117,140,128.5,"Wish
",CA,1,9,1,0,0,0,0
