Job Title,Salary Estimate,Job Description,Rating,Company Name,Location,Headquarters,Size,Founded,Type of ownership,Industry,Sector,Revenue,Competitors,min_salary,max_salary,avg_salary,company_txt,job_state,job_at_hq,age,python_yn,R_yn,spark,aws,excel
Principal Data Scientist,$96K-$101K (Glassdoor est.),"Location: Boston, MA OR San Francisco, CA OR Portland, OR- United States
Job ID: 20WD40121

Security @ Autodesk
Our team of security experts helps Autodesk design, build, deploy and maintain secure products. We are embedding security in the full spectrum of how we build our products from inception, design, development, testing to how we are running them in the cloud as well as how we are responding to any existing or emerging threats to our products or the building blocks of our products and services. Our job is to be one step ahead of the bad guys and use expertise, technology and other resources to thwart their efforts to compromise our products and the environment in which they operate. Our team keeps a single-minded focus on protecting our customer’s data and their investment in our products by strengthening our applications, underlying services and network.

Position Overview
We are seeking an innovative and strategic thinker to help start a data science program within our team. This is an exciting and brand-new position as part of the Autodesk Security organization to develop new capabilities and gain insights through advanced analytics. The ideal candidate will guide the team to design, build, and deploy high-impact analytical models in support of the security program charter.

As a Principal Data Scientist, you will guide strategic planning and insight for security challenges in applications, products, and services throughout the company. You are expected to deliver strategic foresight and drive excellence in the new data science program. You have significant experience and maturity to raise the bar for the department. You will collaborate with stakeholders throughout the organization, including engineers, architects, and management. You will identify opportunities and trade-offs to design and implement solutions to advance the program.

This role is a unique position that will have a lot of freedom and creativity in the fields of data science and analytics. A security background is not required.

This position can be based out of our offices in Boston, Portland, or San Francisco.

Responsibilities
Lead and guide a data science program to help understand how the wealth of security data can drive insights into weaknesses, threats, and opportunities
Work on a variety of challenges and drive the strategic direction of the program
Design, implement, and deploy data analytics technologies
Apply quantitative analysis and data mining to build models that improve the security posture of applications, products, and services
Research new technologies that can improve the team’s agility, performance, and effectiveness
Influence product development and roadmap prioritization
Leverage a creative mindset to solve challenging problems
Collaborate with individuals and teams throughout the organization
Minimum Qualifications
Degree in a quantitative field, computer science, or an engineering discipline
Advanced knowledge of data analytics technologies
Highly technical with both tactical and strategic capabilities
Hands-on working experience with big data use cases, including designing, building and applying analytics applications
Experience working with big data platforms, such as Hadoop, Spark, Hive, etc.
Fluency with one or more programming languages, such as Python, Go, etc.
Statistical programming skills, such as R, Matlab, Python data science toolkits, etc.
Experience working with distributed teams and other cross-functional stakeholders
Experience in an engineering or technical role delivering software solutions
Preferred Qualifications
Knowledge of cloud computing technologies, such as Amazon Web Services (AWS), Microsoft Azure, and Google Cloud Platform (GCP)
Familiarity with Machine Learning (ML) techniques and applications",4.0,"Autodesk
4.0","Boston, MA","San Rafael, CA",5001 to 10000 employees,1982,Company - Public,Computer Hardware & Software,Information Technology,$2 to $5 billion (USD),-1,96,101,98.5,"Autodesk
",MA,0,38,1,0,1,1,1
Data Scientist IV,$96K-$101K (Glassdoor est.),"Overview


Peraton is seeking a Information Data Scientist to support our customer at Fort Meade, MD

Responsibilities


What you’ll do…
Develops machine learning, data mining, statistical and graph-based algorithms to analyze and make sense of datasets; prototype or consider several algorithms and decide upon final model based on suitable performance metrics.
Build models or develop experiments to generate data when training or example datasets are unavailable
Generate reports and visualizations that summarize datasets and provide data-driven insights to customers
Partner with subject matter experts to translate manual data analysis into automated analytics
Implement prototype algorithms within production frameworks for integration into analyst workflows
Qualifications


You’d be a great fit if you have …
Bachelor's and Master's degree from an accredited college or university in a quantitative discipline (e.g., statistics, mathematics, operations research, engineering or computer science). .
Five years of experience analyzing datasets and developing analytics, five years of experience programming with data analysis software such as R, Python, SAS, or MATLAB
An additional two years of experience in software development, cloud development, analyzing datasets, or developing descriptive, predictive, and prescriptive analytics can be substituted for a Master's degree
A PhD from an accredited college or university in a quantitative discipline can be substituted for three years of experience.
Produce data visualizations that provide insight into dataset structure and meaning
Work with subject matters experts (SMEs) to identify important information in raw data and develop scripts that extract this information from a variety of data formats (e.g., SQL tables, structured metadata, network logs)
Incorporate SME input into feature vectors suitable for analytic development and testing
Translate customer qualitative analysis process and goals into quantitative formulations that are coded into software prototypes
Develop and implement statistical, machine learning, and heuristic techniques to create descriptive, predictive, and prescriptive analytics
Develop statistical tests to make data-driven recommendations and decisions
Develop experiments to collect data or models to simulate data when required data are unavailable
Develop feature vectors for input into machine learning algorithms
Identify the most appropriate algorithm for a given dataset and tune input and model parameters
Evaluate and validate the performance of analytics using standard techniques and metrics (e.g. cross validation, ROC curves, confusion matrices)
Oversee the development of individual analytic efforts and guide team in analytic development process
Guide analytic development toward solutions that can scale to large datasets
Partner with software engineers and cloud developers to develop production analytics
Develop and train machine learning systems based on statistical analysis of data characteristics to support mission automation
SECURITY CLEARANCE:

To be considered for this job you must already have an active TS/SCI clearance with a current polygraph.

What you’ll get…
An immediately-vested 401(K) with employer matching
Rapid PTO accrual schedule with floating holidays
Comprehensive medical, dental, and vision coverage
Tuition assistance, financing, and refinancing
Paid maternity and paternity leave
Company-paid infertility treatments
Cross-training and professional development opportunities
The ability to influence major initiatives
SECURITY CLEARANCE This position requires the candidate to be able to obtain and maintain a secret security clearance. In order to obtain a clearance you need to be a US Citizen and show proof of citizenship.

About Peraton


At Peraton, we’re at the forefront of delivering the next breakthrough in national security, every day. We’re the partner of choice to help solve some of the world’s most daunting challenges. How? By thinking differently. We’re not mired in the past. We look at all problems with fresh eyes. We look past the obvious to bring the best talent, tech, and ideas together to completely transform how problems are solved. So bring your unique ideas, your entrepreneurial spirit, and your drive to succeed. Get ready to be part of something bigger. Get ready to do the can’t be done.

EEO Statement


We are an Equal Opportunity/Affirmative Action Employer. We consider applicants without regard to race, color, religion, age, national origin, ancestry, ethnicity, gender, gender identity, gender expression, sexual orientation, marital status, veteran status, disability, genetic information, citizenship status, or membership in any other group protected by federal, state, or local law.",3.4,"Peraton
3.4","Fort Meade, MD","Herndon, VA",1001 to 5000 employees,2017,Company - Private,Aerospace & Defense,Aerospace & Defense,$1 to $2 billion (USD),-1,96,101,98.5,"Peraton
",MD,0,3,1,0,0,0,0
Chief Data Scientist,$96K-$101K (Glassdoor est.),"Position overview:

Teaching Strategies is the industry-leading provider of Whole Child curriculum and assessment solutions, serving Head Start, Public School District, and Private Childcare programs across the United States and abroad. As the Chief Data Scientist, you will build a team to lead the creation of the next generation of data-driven assessment, curriculum and family engagement software for the classroom, childcare environment and home. You will leverage machine learning and other strategies to create, implement and continuously improve the models that drive the effectiveness of teachers, caregivers, and families in support of improved child outcomes. Serving as a member of the senior leadership team, you will work closely with the Teaching Strategies Team to design data-enabled interventions for every stakeholder, while ensuring our research roadmap supports efficacy measurement across all socio-economic subgroups and learning environments.

Your team will define and analyze data sets that enable the company to answer important product questions easily and effectively. You and your team will work with curriculumspecialists, product managers, operations specialists and data engineers to produce data sets and mine themfor insights. Your team will be directly responsible formining data, cleaning it, creatingreproduciblevisualizations,insightsand inferences, and communicating themeffectively.The ideal candidate is motivated, organized, and passionate about demonstrating the impact of technology can have on teacher effectiveness and educational outcomes.

Qualifications:
Data Scientist preferably with expertise in Psychology/Education
Ph.D. or Master's Degree in education measurement, quantitative psychology, applied statistics, or related areas
5-10 years of experience in a data or learning science role
Experience in a statistical programming language(Pythonor R) for data cleaning, munging, analysis, and visualization
Deep knowledge of the standard basket of machine learning algorithms (linear regression, logistic regression, random forests, regularization techniques, cross-validation) and proficiency with using machine learning algorithms in either Python or R
Experimental design knowledge and statistical modeling (such as regression, multilevel modeling, longitudinal analysis, survival analysis, etc.)
Experience writing SQL queries and data transforms against large-scale column-oriented databases (Vertica, Redshift, Snowflake)
Strong desire to explain what you've learned from the data to the rest of the company using visualization frameworks including ggplot and (occasionally) Tableau dashboards
At least three years independent research experience
At least one year research leadership experience
Excellent oral and written communication skills
Experience using ML in education or edtech
A willingness to roll up your sleeves and do what it takes
A desire to fundamentally improve outcomes for the next generation of children and families
Preferred Skills and Qualifications:
Familiarity with adaptive educational technology and psychometric algorithms such as IRT (you will be creating and tuning algorithms for adaptive applications)
Experience participating in the development of commercial software products
Experience with standard metrics in gaming or in education
Experience in custom ETL design, implementation, and maintenance
Experience with data quality frameworks and data validation and verification
Proficiency with H2O andggplotand other common R libraries; has created new R libraries before
Experience buildingreusabledashboards and tools
Experience writing SQL queries and data transforms against large-scale column-oriented databases (Vertica, Redshift, Snowflake, etcetera)
In-depth knowledge of how to write and optimize SQL statement
About us

Teaching Strategies is a high growth, market leading business in early childhood education. The Company provides the most innovative and effective curriculum, assessment, professional development, and family connection resources to programs serving children from birth through 3rd grade. With ground-breaking print and SaaS solutions and a strong belief that the most powerful way to impact child outcomes is to improve teacher effectiveness, Teaching Strategies has been supporting the critical work of early childhood educators for over 30 years.

Located in downtown Bethesda, MD, our company's headquarters are within steps from Bethesda Row and the Bethesda Metro stop. Candidates who fit with our values, vision, and mission will find a work environment that fosters creativity, innovation and career growth. We are building a team of results-oriented individuals who will thrive in a collaborative, work-hard/play-hard culture. We pride ourselves on the impact we have on the early childhood field through supporting teachers who are doing the most important work there is, teaching children to become creative, confident thinkers.

What's in it for you

Teaching Strategies offers our employees a robust suite of benefits and other perks which include:
Beautifully designed, open office space
Endless cereal and coffee
Free on-site gym
Casual dress environment
Company sponsored events
Professional development and growth opportunities
Tuition assistance
Competitive compensation package
Medical, dental, and vision coverage for spouses, domestic partners, and children
Pre-tax medical and dependent care flexible spending accounts (FSA)
Health savings accounts with employer contributions
401(k) plan with employer match
Company sponsored life, short and long term disability insurance
Voluntary life and critical illness insurance
Commuter benefits
Paid parental leave programs
Generous paid time off (which includes Winter Break)
Teaching Strategies, LLC is committed to creating a diverse workplace and is proud to be an equal opportunity employer of Minorities, all Genders, Protected Veterans and Individuals with Disabilities.",3.1,"Teaching Strategies, LLC
3.1","Bethesda, MD","Bethesda, MD",51 to 200 employees,1988,Company - Private,Preschool & Child Care,Education,$50 to $100 million (USD),"Frog Street Press, Scholastic",96,101,98.5,"Teaching Strategies, LLC
",MD,1,32,1,0,0,0,1
Data Scientist,$96K-$101K (Glassdoor est.),"Intro

Why this job?

1. Work on a product people love that solves real problems: Your friends and family can use Notion to take notes, display photos, collect recipes — while Fortune 500 companies use it to run huge teams (and some non-profits use it to conserve wildlife).
2. Help define what data means at Notion: As the first hire working full-time on data at Notion, you'll have outsized influence on what data infrastructure, data analysis, and data team structure look like as we grow the business.
3. Join us at a magical time: We've hit profitability and product-market fit, which gives us a huge green field to work with. You'd join at the perfect time to shape what we build and how we grow.
So, what will you do as a Data Scientist at Notion?
You'll build models to predict things like conversion and likelihood of churn.
You'll build and maintain KPI dashboards that teams rely on for making key decisions.
You'll collaborate with team leads across the business to understand and support their data needs.
You'll build and improve our underlying data infrastructure and tooling. (We currently use DBT, Snowflake, Mode Analytics, Fivetran, Census, Amplitude, Segment, and more).
You might be a fit for this role if...
You've spent meaningful time as a senior data scientist — or even better, you've previously managed a team (there's opportunity to do that here).
You have experience building predictive statistical and machine learning models, and you can build reproducible backtests for proposed models to demonstrate their effectiveness.
You have experience building out data infrastructure which facilitates speed, reliability, and scalability.
You are a SQL expert. You have no problem regularly leveraging window functions, UDFs, self-joins, and other complex SQL functions to accomplish your data analysis goals.
You have a bias for using the right tools to get a job done with maximum efficiency. You are an expert at making tradeoffs between speed and accuracy.
You have strong product sense and user intuition which inform the questions you ask of the data you are analyzing.",5.0,"Notion Labs
5.0","San Francisco, CA","San Francisco, CA",1 to 50 employees,2016,Company - Private,Enterprise Software & Network Solutions,Information Technology,Unknown / Non-Applicable,-1,96,101,98.5,"Notion Labs
",CA,1,4,0,0,0,0,0
Data Scientist,$96K-$101K (Glassdoor est.),"Our Mission
We’re here to create a safer, happier and more mindful future for all with the help of data science, engineering, design, and mobile technology. We're starting by reinventing insurance, by rethinking the technologies that enable it, but our true goal is to build a platform that rewards people for driving well — creating safer roads with fewer accidents in the process.

Backed by impressive funding, we're poised to re-engineer a trillion-dollar category, and that’s just the beginning. We’re using rich customer insights, advanced technology and data science to build our cloud-native InsurTech solution, and other things we haven’t even dreamt up yet. We're out to change behavior and promote mindful living at a societal level. But the key to us being successful in our mission isn’t just about nailing the technology—it’s about hiring the talented people who can help us make a quantifiable impact in the world. We’re growing our world-class team. And that’s where you come in.

The data science team builds the data-driven features of the company.
Requirements for all data scientists
Demonstrable expertise building and supporting machine learning models deployed to production
Expert in Python and core libraries used by data scientists (Numpy, Scipy, Pandas, Scikit-learn, Matplotlib/Seaborn, etc.)
Experience using Jupyter notebooks
Experience working with large or fast moving data sets
Qualified for one of the the specializations below
Specialization: Machine Learning
Scikit-learn expert: This means you have rolled your own transformers and estimators, which you chained together in a pipeline and found optimal hyperparameters via a randomized grid search (or some other method).
Pandas and Numpy expert: You have used pandas enough to run into its rough parts. Very likely you read Wes’ book. You are fluent with Numpy and array oriented programming in general.
Modern techniques: You are deeply familiar with different validation pitfalls, understand how to effectively ensemble several models, and have experimented with different hyperparameter optimization methods.
Modern data: You have built models using unstructured data such as text or images. You have built time series models using econometric approaches as well as machine learning approaches. Deep algorithmic understanding: You know all the nitty-gritty details of your favorite machine learning algorithms.
Specialization: Marketing
Statistical rigor: You should have a solid foundation of the statistics behind standard statistical design methods such as A/B testing and multivariate testing. For example, you should know how to deal with clustering and should be able to determine the standard errors of different statistics through simulation.
Multi-armed bandit models: You know how to implement the technique and how to write a good cost function.
Modern techniques: You can build a model that powers an app that serves a unique arrangement of diverse components to each user such that the specific components served were chosen to maximize the specific user’s probability of selecting a call to action (i.e. using machine learning to identify complex heterogenous treatment effects).
War stories: You must be able to talk about times you ran experiments in a complex environment and what you learned from the effort
Specific experience in marketing optimization is a plus.
Specialization: Insurance
Industry experience: You have solid P&C experience and have had a significant role in building either pricing or underwriting models.
Insurance algorithms: Regulators love GLMs. You must be an expert in GLMs.
Modern tools: Maybe you used SAS in the past, but know you should be comfortable building models with Python.
More details
Salary: We invest in first-rate people and pay top-of-market salaries for most positions, factoring in experience, talent and location. We do not offer equity.
Benefits: Medical, dental, vision, 401(k), wellness reimbursement, four weeks of vacation + six weeks of parental leave, and great work-life balance. Our office building offers on-site shower and bike stalls, and panoramic views of San Francisco.
Location: Due to COVID-19 our teams are all working remotely through 2020. We provide an in-home office set-up including laptop, monitor, ergonomic desk, chair and other items as needed
Location: Post COVID-19: San Francisco, CA near Montgomery Bart Station
To apply for this role, you must complete a simple tech challenge based on the specialization you choose. Each specialization has a unique coding exercise.

Machine Learning simple tech challenge
Marketing simple tech challenge
Insurance simple tech challenge

All are welcome at Blue Owl. We are an equal opportunity and affirmative action employer who values diversity and inclusion and looks for applicants who understand, embrace and thrive in a multicultural world. We do not discriminate on the basis of race, color, ancestry, religion, sex, national origin, sexual orientation, age, citizenship, marital status, disability, gender identity or Veteran status. Pursuant to the San Francisco Fair Chance Ordinance, we will consider for employment qualified applicants with arrest and conviction records.

If you are a San Francisco resident, please read the City and County of San Francisco's Fair Chance Ordinance notice.
https://sfgov.org/olse/sites/default/files/FCO%20poster2020.pdf",4.5,"Blue Owl
4.5","San Francisco, CA","San Francisco, CA",51 to 200 employees,2016,Company - Private,Internet,Information Technology,Unknown / Non-Applicable,-1,96,101,98.5,"Blue Owl
",CA,1,4,1,0,0,0,0
